{"$schema":"https://json-schema.org/draft/2020-12/schema","$id":"control-record.schema.json","title":"AI Engineering Control Record 0.2","type":"object","additionalProperties":false,"required":["schema_version","record_id","title","lifecycle_phase","repository_context","acceptance_contract","risk_profile","execution_plan","evidence_ledger","adapter_results","policy_decisions","open_actions","current_decision_refs","legacy_sources"],"properties":{"schema_version":{"type":"string","const":"0.2.0"},"record_id":{"type":"string","pattern":"^AICR-[A-Za-z0-9._-]+$"},"title":{"type":"string","minLength":1},"created_at":{"type":"string","format":"date-time"},"updated_at":{"type":"string","format":"date-time"},"lifecycle_phase":{"type":"string","enum":["DRAFT","CONTRACTED","CLASSIFIED","AUTHORIZED","EXECUTING","VERIFYING","DECIDED","CLOSED"]},"repository_context":{"type":"object","additionalProperties":false,"required":["repository","base_ref"],"properties":{"repository":{"type":"string","minLength":1},"base_ref":{"type":"string","minLength":1},"head_ref":{"type":"string"},"head_commit":{"type":"string"},"worktree":{"type":"string"}}},"acceptance_contract":{"$ref":"acceptance-contract.schema.json"},"risk_profile":{"$ref":"risk-profile.schema.json"},"execution_plan":{"type":"object","additionalProperties":false,"required":["tasks"],"properties":{"tasks":{"type":"array","items":{"$ref":"control-record.schema.json#/$defs/task"}}}},"evidence_ledger":{"type":"array","items":{"$ref":"evidence-entry.schema.json"}},"adapter_results":{"type":"array","items":{"$ref":"adapter-result.schema.json"}},"policy_decisions":{"type":"array","items":{"$ref":"policy-decision.schema.json"}},"open_actions":{"type":"array","items":{"$ref":"control-record.schema.json#/$defs/openAction"}},"current_decision_refs":{"type":"object","additionalProperties":false,"properties":{"modify":{"type":"string","pattern":"^DEC-[A-Za-z0-9._-]+$"},"merge":{"type":"string","pattern":"^DEC-[A-Za-z0-9._-]+$"},"push":{"type":"string","pattern":"^DEC-[A-Za-z0-9._-]+$"},"release":{"type":"string","pattern":"^DEC-[A-Za-z0-9._-]+$"},"cleanup":{"type":"string","pattern":"^DEC-[A-Za-z0-9._-]+$"}}},"derived_views":{"type":"object","description":"Regenerable, non-authoritative projections.","additionalProperties":true},"legacy_sources":{"type":"array","items":{"type":"object","additionalProperties":false,"required":["system","version","source_ref"],"properties":{"system":{"type":"string","enum":["completion-discipline","ai-coding-delivery-gate","git-worktree-safety","other"]},"version":{"type":"string"},"source_ref":{"type":"string","minLength":1},"migration_notes":{"type":"string"}}}}},"$defs":{"task":{"type":"object","additionalProperties":false,"required":["task_id","title","subject_refs","status"],"properties":{"task_id":{"type":"string","pattern":"^TASK-[A-Za-z0-9._-]+$"},"title":{"type":"string","minLength":1},"subject_refs":{"type":"array","minItems":1,"items":{"type":"string","pattern":"^(REQ|ACC|INV|ASM|Q|RISK|EV|DEC|ACT|TASK|UNDER|ADP|ACON|RPA)-[A-Za-z0-9._-]+$|^(PATH|MODULE|SERVICE|API|DB|ENV):.+$"},"uniqueItems":true},"status":{"type":"string","enum":["PENDING","IN_PROGRESS","COMPLETED","DEFERRED","REJECTED"]},"reason":{"type":"string"},"next_action":{"type":"string"},"disclosed_to_user":{"type":"boolean"}}},"openAction":{"type":"object","additionalProperties":false,"required":["action_id","subject_refs","statement","status","owner"],"properties":{"action_id":{"type":"string","pattern":"^ACT-[A-Za-z0-9._-]+$"},"subject_refs":{"type":"array","minItems":1,"items":{"type":"string","pattern":"^(REQ|ACC|INV|ASM|Q|RISK|EV|DEC|ACT|TASK|UNDER|ADP|ACON|RPA)-[A-Za-z0-9._-]+$|^(PATH|MODULE|SERVICE|API|DB|ENV):.+$"},"uniqueItems":true},"statement":{"type":"string","minLength":1},"status":{"type":"string","enum":["OPEN","DONE","DEFERRED","REJECTED"]},"owner":{"type":"string","minLength":1},"required_evidence":{"type":"array","items":{"type":"string","enum":["automated_test","manual_test","review","db_probe","real_host_verify","deploy_probe","git_state","ci","static_analysis","security_scan","runtime_observation","document","human_approval","assumption_validation","other"]},"uniqueItems":true}}}}}
