{
  "schema_version": "0.2.0",
  "record_id": "AICR-example",
  "title": "Example completion task",
  "created_at": "2026-07-23T17:51:03Z",
  "updated_at": "2026-07-23T17:51:03Z",
  "lifecycle_phase": "CONTRACTED",
  "repository_context": {"repository": "example/repository", "base_ref": "main"},
  "acceptance_contract": {
    "contract_id": "ACON-example",
    "version": 1,
    "status": "DRAFT",
    "profile": "TASK",
    "created_at": "2026-07-23T17:51:03Z",
    "updated_at": "2026-07-23T17:51:03Z",
    "objective": {"statement": "Demonstrate the native Completion Profile."},
    "scope": {"allowed": [{"ref": "MODULE:csv-import", "description": "Initial completion-discipline task scope"}], "forbidden": [], "out_of_scope": []},
    "requirements": [{"req_id": "REQ-001", "statement": "Import a CSV file with documented columns.", "source_refs": ["example:user-request"], "kind": "FUNCTIONAL", "priority": "MEDIUM", "disposition": "ACTIVE", "disclosed_to_user": false, "acc_refs": ["ACC-001"], "inv_refs": []}],
    "acceptance_criteria": [{"acc_id": "ACC-001", "statement": "A valid CSV is imported and invalid columns are rejected.", "req_refs": ["REQ-001"], "criticality": "MEDIUM", "verification": {"required_categories": ["automated_test"], "pass_condition": "The required evidence category has an effective PASS entry."}}],
    "invariants": [],
    "assumptions": [],
    "open_decisions": [],
    "change_control": {"triggers": ["ACCEPTANCE_CRITERIA_CHANGE", "INVARIANT_CHANGE", "FORBIDDEN_SCOPE_TOUCHED", "VERIFICATION_BECOMES_UNAVAILABLE"], "reapproval_required": true}
  },
  "risk_profile": {"assessment_id": "RPA-example", "status": "DRAFT", "overall_risk": {"level": "UNKNOWN", "rationale": "Completion Discipline tracks requirement closure but does not classify engineering risk.", "method": "JUDGMENT"}, "dimensions": {}, "risk_items": [], "understanding_requirements": []},
  "execution_plan": {"tasks": [{"task_id": "TASK-001", "title": "Implement and verify REQ-001", "subject_refs": ["REQ-001", "ACC-001"], "status": "PENDING", "reason": "", "next_action": "", "disclosed_to_user": false}]},
  "evidence_ledger": [],
  "adapter_results": [],
  "policy_decisions": [],
  "open_actions": [],
  "current_decision_refs": {},
  "derived_views": {},
  "legacy_sources": []
}
